en,fr,it,de,es,ko,kana
"It usually passes its time in the water. When its belly is full, it stores its subdued prey in the water bubble on its head.","Il passe la plupart de son temps dans l’eau. S’il est rassasié, il peut conserver ses proies dans sa bulle pour les manger plus tard.","Se ne sta per lo più in acqua. Quando è sazio, conserva le prede che ha catturato nella bolla che ha in testa.","Es verlässt das Wasser nur sehr selten. Wenn es satt ist, bewahrt es erledigte Beute in der Wasserblase auf seinem Kopf auf.","Pasa la mayor parte del tiempo en el agua. Si atrapa alguna presa sin tener hambre, la almacena en la burbuja de su cabeza.",평소에는 물 안에서 지낸다. 배가 부를 때는 숨통을 끊은 먹이를 머리의 수포에 넣어 둔다.,ふだんは　みずのなかで　すごす。 　まんぷくの　とき　しとめた　えものは 　あたまの　すいほうに　しまっておく。
"When the sun rises, Fomantis spreads its four leaves and bathes in the sunlight. The tip of its head has a pleasant aroma.","Quand le jour se lève, il déploie ses quatre feuilles pour prendre un bain de soleil. Une odeur agréable émane du haut de sa tête.",Quando esce il sole dispiega le sue quattro foglie per assorbirne la luce. Il suo capo emana un profumo molto gradevole.,"Scheint die Sonne, streckt es seine vier Blätter von sich und badet im Licht. Von seiner Kopfspitze geht ein angenehmer Duft aus.","Al salir el sol, expande sus cuatro hojas buscando la luz. De su cabeza emana un agradable aroma.",해가 뜨면 4장의 잎을 펼치고 일광욕한다. 머리끝에서 좋은 냄새가 난다.,ひが　のぼると　４まいの　はっぱを 　ひろげ　にっこうよく。　あたまの 　さきから　いい　においが　するよ。
"For self-protection, it pretends to be a bug Pokémon. Both of its arms bear keen-edged petals.",C’est pour se protéger qu’il se fait passer pour un Pokémon Insecte. Les pétales de ses bras sont extrêmement coupants.,Cerca di farsi passare per Pokémon Coleottero per proteggersi. I petali delle sue braccia sono estremamente affilati.,Es tarnt sich zu seinem eigenen Schutz als Käfer-Pokémon. Die Blütenblätter an seinen beiden Armen sind scharfkantig.,Se hace pasar por Pokémon de tipo Bicho como mecanismo de defensa. Los pétalos de sus brazos tienen un filo muy agudo.,벌레포켓몬인 척하는 것은 몸을 지키기 위해서다. 양팔의 꽃잎은 예리해서 잘 자른다.,むしポケモンの　ふりを　するのは 　みを　まもるため。　りょううでの 　はなびらは　するどい　きれあじ。
"It scatters its shining spores around itself. Even though they’re dangerous, nighttime tours of forests where Morelull live are popular.","Il répand des spores luminescentes autour de lui. Malgré le danger qu’il représente, les balades nocturnes dans les bois où il vit sont populaires.","Sparge tutt’intorno spore brillanti. Nonostante il pericolo, i tour notturni nei boschi in cui vivono i Morelull vanno molto di moda.","Es streut blinkende Sporen aus. Obgleich nicht ungefährlich, sind nächtliche Führungen durch Wälder, in denen Bubungus leben, sehr beliebt.","Esparce esporas luminosas a su alrededor. A pesar del peligro, los tours nocturnos a través de los bosques que habitan son muy populares.",빛이 나는 포자를 주변에 흩뿌린다. 위험하지만 자마슈가 사는 숲의 밤 여행 투어는 인기가 있다.,ひかるほうしを　あたりに　ばらまく。 　きけんだが　ネマシュのすむ　もりへの 　ナイトツアーは　にんきが　ある。
"It puts its prey to sleep and siphons off their vitality through the tip of its arms. If one of its kind is weakened, it helps by sending it vitality.",Il endort ses victimes puis aspire leur énergie vitale avec ses doigts. Il aide ses congénères affaiblis en partageant cette énergie avec eux.,"Addormenta la preda e utilizza le estremità delle sue braccia per rubarle l’energia vitale, che può anche trasmettere ai compagni in difficoltà.",Es lullt seine Gegner in den Schlaf und raubt ihnen über seine Fingerspitzen die Lebenskraft. Diese schickt es schwächelnden Kameraden.,"Duerme a su presa y le arrebata la vitalidad con sus brazos. Si otro Shiinotic se encuentra en apuros, le transmite sus fuerzas.",먹이를 잠들게 하고 팔 끝으로 생기를 빼앗는다. 동료가 약해지면 생기를 보내 도와준다.,えものを　ねむらせ　うでの　さきから 　せいきを　うばう。　なかまが　よわると 　せいきを　おくって　たすけてあげる。
"The males will do whatever the females tell them. They give the females most of their food. Due to malnutrition, the males can’t evolve.","La femelle domine le mâle, qui ne peut évoluer en raison de carences nutritionnelles. Il lui offre en effet presque toutes ses proies en tribut.","I maschi di Salandit sono del tutto in balia delle femmine, a cui offrono ogni preda catturata. Non si evolvono a causa della malnutrizione.","Das Männchen ist dem Weibchen hörig. Da es diesem fast seine gesamte Beute gibt, leidet es an Unterernährung und entwickelt sich nicht.","Los machos están a merced de las hembras. Les ceden la mayoría de presas que capturan, y la falta de nutrientes les impide evolucionar.",수컷은 거의 암컷의 지시에 따른다. 잡아 온 먹이도 거의 바치기 때문에 영양 부족으로 진화할 수 없다.,オスは　メスの　ほぼ　いいなり。 　とった　エサも　ほとんど　みつぐので 　えいようぶそくで　しんか　できない。
Salazzle lives deep in caves and forces the Salandit it has attracted with its pheromones to serve it.,Ce Pokémon habite au fin fond des cavernes. Il se fait servir par des Tritox envoûtés par ses phéromones.,Vive nel profondo delle caverne e si circonda di Salandit che ammalia con i suoi potenti feromoni.,"Dieses tief in Höhlen lebende Pokémon hält sich männliche Molunk, die es sich mit Pheromonen hörig gemacht hat, als Diener.","Vive en las profundidades de las cuevas. Gracias a sus feromonas, atrae Salandit y los hace presas de su voluntad.",동굴 깊은 곳에서 살며 페로몬으로 헤롱헤롱하게 만들어 야도뇽을 시중들게 한다.,どうくつの　おくふかくに　すみ 　フェロモンで　メロメロに　した 　ヤトウモリたちを　はべらせている。
It boasts power enough to split large trees in half. The organ on its rear releases an odor that it uses to communicate with others of its kind.,Il est si fort qu’il peut abattre un grand arbre. L’odeur que dégage l’organe sur son derrière lui permet de communiquer avec ses semblables.,Riesce a spezzare anche gli alberi più grossi. Comunica con i suoi simili usando l’odore che emana da un organo che ha sul posteriore.,"Es ist stark genug, um große Baumstämme zu zerbrechen. Über Düfte aus dem Organ am Hinterteil kommuniziert es mit Artgenossen.",Es capaz de derribar un árbol con su fuerza. Se comunica con sus congéneres mediante el olor que emite el órgano de su parte posterior.,큰 나무도 꺽을 만큼 힘이 세다. 엉덩이의 기관에서 냄새를 풍겨 동료와 커뮤니케이션을 한다.,たいぼくも　へしおる　ちからじまん。 　おしりの　きかんから　においを　だし 　なかまと　コミュニケーションをとる。
It waves its hands wildly in intimidation and warning. Life is over for anyone who doesn’t run away as fast as possible.,Il fait de grands gestes avec ses pattes pour intimider et mettre en garde ses ennemis. Mieux vaut alors prendre ses jambes à son cou!,Agita energicamente le braccia in segno di minaccia o di avvertimento. L’unica via di scampo è darsela a gambe.,"Wenn es wild mit seinen Armen wedelt, ist das eine warnende Drohgebärde. Wem sein Leben lieb ist, sollte schleunigst die Flucht ergreifen.",Agita violentamente los brazos como amenaza. Quien presencie este gesto debe huir en el acto si aprecia su vida.,손을 크게 휘두르는 것은 위협과 경계의 신호다. 재빨리 도망치지 않으면 목숨을 보장할 수 없다.,おおきく　てを　ふるのは　いかくと 　けいかいの　サイン。　いっこくも 　はやく　にげないと　いのちは　ない。
"Because of its sweet, delicious aroma, bird Pokémon are always after it, but it’s not intelligent enough to care.","Son odeur appétissante en fait la cible idéale des Pokémon oiseaux, mais comme il n’est pas très malin, ça lui est égal.","A causa del suo profumino delizioso, Bounsweet è preda di molti Pokémon alati, ma non essendo molto perspicace non se ne preoccupa granché.","Da es einen köstlich süßen Duft verströmt, wird es oft von Vogel-Pokémon angegriffen. Das stört es jedoch nicht, weil es nicht sehr helle ist.","El dulce aroma que desprenden los convierte en presa de los Pokémon pájaro, pero, al no ser muy avispados, no se alteran en absoluto.",달고 맛있는 냄새 때문에 새포켓몬이 타깃으로 삼지만 영리하지 않아 신경 쓰지 않는다.,あまく　おいしそうな　においのせいで 　とりポケモンに　ねらわれるが　あまり 　かしこくないので　きに　していない。
"It’s protected by its hard sepals, so it plays with bird Pokémon without worry. They peck it relentlessly, but it doesn’t care.","Confiant en la protection offerte par son solide calice, il n’hésite pas à jouer avec les Pokémon oiseaux. Il se fait picorer, mais il s’en moque.",Gioca tranquillamente anche con i Pokémon alati perché si sente protetto dalle sue rigide foglie. Non sembra preoccuparsi delle loro beccate.,"Es kann bedenkenlos mit Vogel-Pokémon spielen, da sein fester Blütenkelch es schützt. Das pausenlose Gepicke ist ihm einerlei.",Puede jugar con Pokémon pájaro sin peligro gracias al duro cáliz que protege su cuerpo. No le importa que lo picoteen.,딱딱한 꼭지로 보호되기 때문에 새포켓몬과도 문제없이 논다. 쪼여도 신경 쓰지 않는다.,かたいヘタで　まもられているので 　とりポケモンとも　へいきで　あそぶ。 　つつかれまくるが　きに　していない。
"A master of grand and beautiful kicks, it can knock out even kickboxing champions with a single blow.",Ce véritable virtuose du coup de pied peut mettre K.O. un champion de kick-boxing en une seule frappe.,Tira calci con grazia ed eleganza. Uno solo dei suoi colpi è sufficiente per mandare al tappeto anche un campione di kickboxing.,Seine Kicktechniken sind äußerst grazil. Selbst Kickbox-Champions kann es mit einem einzigen Tritt auf die Bretter befördern.,Propina bellas patadas con elegancia. Una sola bastaría para dejar fuera de combate a un campeón de kickboxing.,아름다운 발차기의 전문가다. 킥복싱의 챔피언도 일격으로 녹아웃시킨다.,うつくしい　けりわざの　つかいて。 　キックボクシングの　チャンピオンも 　いちげきで　ノックアウトするぞ。
"It stretches sticky vines out from its head and picks flowers to adorn itself with. When it doesn’t have any flowers, it feels uneasy.",Il ramasse des fleurs en déployant la liane gluante accrochée à sa tête et s’en agrémente. Il se sent mal à l’aise lorsqu’il n’en a pas.,"Ama adornare di fiori la liana appiccicosa che gli spunta dalla testa. Se resta senza fiori, si fa prendere dall’ansia.","Mit der klebrigen Ranke an seinem Kopf pflückt es Blumen und schmückt sich dann mit ihnen. Fehlt ihm sein Blütenschmuck, wird es nervös.",Adorna con flores el tallo pegajoso que brota de su cabeza. Sin ellas se siente intranquilo.,머리에서 끈적거리는 시위를 늘려서 꽃을 따서 치장한다. 꽃이 없으면 불안하다.,あたまから　ねばりけの　ある　ツルを 　のばして　はなを　つんで　じぶんを 　かざる。　はなが　ないと　ふあん。
It normally spends its time meditating in the treetops. It throws Poké Balls and gives other Pokémon orders as it pleases.,Il médite généralement en haut des arbres. Il se permet de lancer des Poké Balls sur les autres Pokémon et leur donne des ordres.,Solitamente passa il tempo meditando in cima agli alberi. A volte si diverte a lanciare Poké Ball e dare ordini agli altri Pokémon.,Es verbringt die meiste Zeit in Meditation auf Baumwipfeln. Manchmal wirft es Pokébälle auf Pokémon und erteilt ihnen Befehle.,"Se pasa las horas meditando en lo alto de los árboles. Cuando se le antoja, lanza Poké Balls a otros Pokémon y les da órdenes.",평소에는 나무 위에서 명상하며 지낸다. 제멋대로 몬스터볼을 던져 포켓몬에게 명령한다.,ふだんは　きのうえで　めいそうして 　すごす。　かってにモンスターボールを 　なげて　ポケモンに　めいれいする。
They use their saliva to stick leaves to their shoulders. You can tell what troop they belong to from the position of the leaves.,Il utilise sa salive pour coller des feuilles sur ses épaules. Leur disposition indique son appartenance à un groupe particulier.,"Le foglie sulle spalle, attaccate con la saliva, formano un simbolo che identifica il gruppo di appartenenza di ogni Passimian.","Mit Speichel klebt es sich Blätter als Markierung auf die Schultern. Die Anordnung dieser Blätter zeigt, welcher Gruppe sie angehören.",Adorna sus hombros con hojas que adhiere con su saliva. La distribución de estas hojas indica a qué manada pertenece.,침으로 어깨에 잎사귀를 붙여서 마킹한다. 잎사귀의 위치로 어느 무리인지 알 수 있다.,だえきを　つかって　はっぱを　かたに 　はりつけて　マーキング。　はっぱの 　はいちで　どの　むれか　わかるよ。
"It will pick up anything it finds on the ground. Sometimes it finds coins, so Murkrow and Meowth will go after it.","Il ramasse tout ce qu’il trouve par terre, y compris des pièces. Cela lui vaut d’être pris pour cible par les Cornèbre et les Miaouss.",Raccoglie da terra ogni tipo di oggetto. Quando trova delle monete viene preso di mira da Murkrow e Meowth.,"Es hebt alles auf, was es finden kann. Manchmal befinden sich darunter auch Münzen, weshalb es oft von Kramurx und Mauzi gejagt wird.","Recoge todo lo que encuentra por el suelo. A veces recoge monedas, lo que atrae la atención de Murkrow y Meowth.",떨어져 있는 것은 뭐든지 줍는다. 동전을 갖고 있을 때도 있어 니로우나 나옹이 노리고 있다.,おちてるものは　なんでも　ひろう。 　コインを　もっていることも　あるので 　ヤミカラスやニャースに　ねらわれる。
The shell covering its body is as hard as diamond. This Pokémon will do anything it takes to win.,La carapace qui recouvre son corps est aussi dure que le diamant. Il ne recule devant rien pour gagner.,Il durissimo carapace che protegge il suo corpo è resistente come il diamante. Questo Pokémon è disposto a tutto pur di vincere.,"Der harte Panzer auf seinem Rücken steht Diamanten in Sachen Härte in nichts nach. Um zu gewinnen, sind ihm alle Mittel recht.",El caparazón que protege su cuerpo es tan duro como el diamante. Hará lo que sea por conseguir la victoria.,몸을 덮고 있는 두꺼운 껍질은 다이아몬드 정도의 강도다. 이기기 위해서는 수단을 가리지 않는다.,からだを　おおう　かたいカラは 　ダイヤモンドなみの　きょうどを　もつ。 　かつためには　しゅだんを　えらばない。
"It likes the shovel on its head, so Sandygast will get serious and fight any children who come to take it back.","Il tient beaucoup à la pelle sur sa tête. Si un enfant cherche à la récupérer, il se bat sans retenir ses coups pour la garder.","È affezionato alla paletta che ha nel capo. Se arriva un bambino per riprendersela, si scatena una vera e propria zuffa.","Die Schaufel auf seinem Kopf ist sein größter Schatz. Versucht ein Kind, sich seine Schaufel zurückzuholen, gibt es diese nicht kampflos auf.","Siente mucho apego por la pala de su cabeza. Si un niño intenta quitársela, se enfurece y pelea por ella.",머리의 삽을 마음에 들어한다. 되찾으러 온 아이와 싸우다가 열을 올리면서 치고 받고 싸운다.,あたまの　スコップは　おきにいり。 　とりかえしにきた　こどもと　ケンカ。 　ムキに　なって　なぐりあいに　なる。
Each of its grains of sand has its own will. Palossand eats small Pokémon and siphons away their vital essence while they’re still alive.,Chacun de ses grains de sable a sa volonté propre. Trépassable gobe de petits Pokémon pour absorber leur énergie vitale.,Ognuno dei suoi granelli ha una volontà propria. Inghiotte vivi i Pokémon più piccoli e ne ruba l’energia vitale.,Jedes einzelne seiner Körner verfügt über einen eigenen Willen. Kleine Pokémon verschluckt es lebendig und saugt ihnen die Lebensenergie aus.,Cada grano de arena de su cuerpo tiene voluntad propia. Engulle a Pokémon pequeños estando aún vivos para robarles la energía vital.,한 알의 모래에도 의지가 있다. 작은 포켓몬을 산 채로 삼켜서 생기를 뺏는다.,ひとつぶの　すなにも　いしが　ある。 　ちいさな　ポケモンを　のみこみ 　いきたまま　せいきを　うばう。
The tradition known as Pyukumuku chucking started from the custom of throwing Pyukumuku back into the sea after they wash onshore.,Lancer à la mer les Concombaffe venus s’échouer sur le rivage était une habitude qui s’est depuis muée en une véritable tradition.,L’abitudine di ributtare in mare gli esemplari spiaggiati ha dato origine a una vera e propria tradizione.,"Das heutzutage übliche Gufa-Schleudern ist aus dem Brauch entstanden, angespülte Gufa wieder ins Meer zurückzuwerfen.",La costumbre de lanzar de nuevo al agua los Pyukumuku que han sido arrastrados hasta la orilla se ha convertido en toda una tradición.,해무기던지기라는 문화는 육지로 밀려온 해무기를 바다로 던져 돌려보내는 습관에서 시작되었다.,ナマコブシなげ　という　ぶんかは 　うちあげられた　ナマコブシを　うみに 　なげかえす　しゅうかんが　はじまり。
"A Pokémon weapon developed for a specific mission, it went berserk during an experiment, so it was cryogenically frozen.","Développé en tant qu’arme dans un but bien précis, il est devenu incontrôlable lors d’une expérience et a dû être cryogénisé.",È stato creato come arma per una missione precisa. Fu ibernato dopo aver perso il controllo durante un esperimento.,Dieses für einen bestimmten Zweck als Waffe kreierte Pokémon geriet bei einem Experiment außer Kontrolle und wurde deshalb stillgelegt.,Este Pokémon se creó en un laboratorio como arma para cierto fin. Fue criogenizado tras desbocarse durante un experimento.,특정 임무를 위해 개발된 포켓몬 병기다. 실험 중에 폭주해서 중단되었다.,あるにんむの　ために　かいはつされた 　ポケモンへいき。　じっけんちゅうに 　ぼうそうした　ため　とうけつされた。
"This is its form once it has awakened and evolved. Freed from its heavy mask, its speed is greatly increased.",Il a réveillé tout son potentiel et a évolué. Briser son lourd masque a décuplé sa vitesse.,"Ha risvegliato il suo potere nascosto e si è evoluto. Svincolato dalla pesante maschera, la sua velocità è notevolmente aumentata.","Nun, da es erwacht ist und im Verlauf der Entwicklung seine schwere Maske verlor, hat es deutlich an Geschwindigkeit hinzugewonnen.","Esta es la forma que adopta tras evolucionar y despertar todo su potencial. Al deshacerse de su máscara, su velocidad ha aumentado mucho.",각성으로 진화한 모습이다. 무거운 마스크에서 벗어나 스피드가 크게 올라갔다.,かくせいし　しんかした　すがた。 　おもい　マスクから　ときはなたれ 　スピードが　おおはばに　アップ。
"It lives in the ozone layer, where it becomes food for stronger Pokémon. When it tries to run away, it falls to the ground.","Il vit dans la couche d’ozone, où des Pokémon plus forts que lui cherchent à le manger. Il tombe à terre lorsqu’il tente de s’enfuir.","Vive nello strato d’ozono, dove Pokémon più forti di lui lo cacciano per cibarsene. Spesso precipita sulla terraferma cercando di fuggire.","Es lebt in der Ozonschicht und dient stärkeren Pokémon als Nahrung. Wenn es vor ihnen flieht, stürzt es auf die Oberfläche des Planeten.","Vive en la capa de ozono, donde puede resultar presa de Pokémon más fuertes. Al huir, acaba precipitándose a tierra firme.",오존층에 살며 더 강한 포켓몬의 먹이가 된다. 도망치다 지상으로 떨어진다.,オゾンそうに　すみ　より　つよい 　ポケモンの　エサに　なっている。 　にげるうちに　ちじょうに　おちてくる。
"It stays asleep from the moment it’s born. When it falls into a deep sleep, it stops moving altogether.","Il dort continuellement depuis sa naissance. Lorsqu’il est en phase de sommeil profond, il ne bouge plus d’un poil.",Dorme ininterrottamente fin dalla nascita. Quando il suo sonno è particolarmente profondo rimane completamente immobile.,"Vom Augenblick seiner Geburt an verbringt es sein ganzes Leben schlafend. Wenn es extrem tief schläft, wird es völlig regungslos.","Duerme continuamente desde que nace. Cuando el sueño en el que está sumido es especialmente profundo, se queda inmóvil.",태어날 때부터 계속 자고 있다. 깊은 수면에 빠져 있을 때는 일체 움직이지 않는다.,うまれてから　ずっと　ねむったまま。 　ふかい　ねむりに　おちているときは 　いっさい　うごかなくなる。
It lives in volcanoes and eats sulfur and other minerals. Materials from the food it eats form the basis of its explosive shell.,Il vit dans les volcans et se nourrit de soufre et de minéraux. Les composants de ses repas renforcent sa carapace explosive.,"Vive nei vulcani e si nutre di zolfo e minerali, che rendono il suo carapace esplosivo.","Es lebt an Vulkanen, wo es sich von Schwefel und Mineralien ernährt. Durch diese Bestandteile wird sein Rückenpanzer explosiv.",Vive en los volcanes y se alimenta de azufre y minerales. Los componentes que ingiere le sirven para formar su caparazón explosivo.,화산에 살며 황이나 광물을 먹는다. 먹은 먹이의 성분이 폭발하는 등껍질의 바탕이 된다.,かざんに　すみ　いおうや　こうぶつを 　くっている。　くったエサの　せいぶんが 　ばくはつする　こうらの　もとに　なる。
"When it’s surprised or agitated, the 14 fur spikes on its back will stand up involuntarily.",Les quatorze épines de son dos se hérissent de leur propre chef quand il est surpris ou excité.,"Quando viene infastidito o colto di sorpresa, le 14 spine che ha sulla schiena si drizzano spontaneamente.","Es hat 14 lange stachelartige Strähnen auf dem Rücken, die sich unfreiwillig aufstellen, wenn es sich freut oder von etwas überrascht wird.",Eriza inconscientemente las 14 púas de su lomo cuando se asusta o se pone nervioso.,등에 난 14개의 바늘 털은 놀라거나 흥분했을 때 멋대로 곤두선다.,１４ほんの　せなかの　ハリの　けは 　びっくりしたり　こうふんすることが 　あると　かってに　さかだってしまう。
"Although it’s a quiet, lonely Pokémon, if you try to look at what’s under its rag, it will become agitated and resist violently.","Ce Pokémon docile déteste la solitude, mais il oppose une résistance acharnée si l’on essaie de jeter un coup d’œil sous son déguisement.","È un Pokémon tranquillo che soffre di solitudine. Se qualcuno cerca di sbirciare sotto il panno che lo nasconde, si oppone con forza.","Eigentlich ist es friedlich und sehnt sich nur nach Gesellschaft, doch versucht man, unter seinen Lumpen zu linsen, wehrt es sich heftig.","Es de carácter tranquilo y propenso a sentirse solo. Odia que intenten mirar bajo su saco, y se resiste con todas sus fuerzas.","얌전하고 외로움을 잘 타지만, 넝마 조각의 속을 보려고 하면 격렬하게 싫어하며 저항한다.",おとなしい　さみしがりや　だけど 　ボロきれの　なかみを　みようとすると 　はげしく　いやがり　ていこうする。
"It burrows beneath the sand, radiating psychic power from the protuberance on its head. It waits for prey as it surveys the area.","Enfoui dans le sable, il projette ses pouvoirs psychiques via l’appendice qu’il a sur la tête, et scanne les environs en attendant sa proie.",Si nasconde nella sabbia ed emette il suo potere psichico dalla protuberanza sulla testa. Aspetta la preda sorvegliando l’ambiente che lo circonda.,Es vergräbt sich im Sand und setzt über den Fortsatz an seinem Kopf Psycho-Kräfte frei. So scannt es die Gegend ab und wartet auf Beute.,"Oculto bajo la arena, emite poderes psíquicos por la protuberancia de su cabeza. Analiza el entorno mientras espera a que caiga su presa.",모래로 숨어들어 머리의 돌기에서 사이코 파워를 방사한다. 주변의 상태를 탐지하면서 먹이를 기다린다.,すなに　もぐり　あたまの　とっきから 　サイコパワーを　ほうしゃ。　あたりの 　ようすを　さぐりつつ　えものを　まつ。
