en,fr,it,de,es,ko,kana
,,,,,,
"Bulbasaur can be seen napping in bright sunlight. There is a seed on its back. By soaking up the sun’s rays, the seed grows progressively larger.",Bulbizarre passe son temps à faire la sieste sous le soleil. Il y a une graine sur son dos. Il absorbe les rayons du soleil pour faire doucement pousser la graine.,È possibile vedere Bulbasaur mentre schiaccia un pisolino sotto il sole. Ha un seme piantato sulla schiena. Grazie ai raggi solari il seme cresce ingrandendosi progressivamente.,"Bisasam macht gern einmal ein Nickerchen im Sonnenschein. Auf seinem Rücken trägt es einen Samen. Indem es Sonnenstrahlen aufsaugt, wird er zunehmend größer.",A Bulbasaur es fácil verle echándose una siesta al sol. La semilla que tiene en el lomo va creciendo cada vez más a medida que absorbe los rayos del sol.,양지에서 낮잠 자는 모습을 볼 수 있다. 태양의 빛을 많이 받으면 등의 씨앗이 크게 자란다.,ひなたで　ひるねを　する　すがたを　みかける。 たいようの　ひかりを　いっぱい　あびることで せなかの　タネが　おおきく　そだつのだ。
"There is a bud on this Pokémon’s back. To support its weight, Ivysaur’s legs and trunk grow thick and strong. If it starts spending more time lying in the sunlight, it’s a sign that the bud will bloom into a large flower soon.","Un bourgeon a poussé sur le dos de ce Pokémon. Pour en supporter le poids, Herbizarre a dû se muscler les pattes. Lorsqu’il commence à se prélasser au soleil, ça signifie que son bourgeon va éclore, donnant naissance à une fleur.","C’è un germoglio piantato nella schiena di Ivysaur. Per sopportarne il peso, le zampe e il corpo crescono robusti. Quando inizia a passare più tempo esposto al sole, significa che il germoglio sboccerà presto in un grande fiore.","Bisaknosp hat eine Knospe auf seinem Rücken. Seine Beine und sein Stamm sind kräftig genug, um sein Gewicht zu tragen. Wenn es lange in der Sonne liegt, ist das ein Anzeichen dafür, dass die Knospe bald blüht.","Este Pokémon lleva un bulbo en el lomo y, para poder con su peso, tiene unas patas y un tronco gruesos y fuertes. Si empieza a pasar más tiempo al sol, será porque el bulbo está a punto de hacerse una flor grande.",꽃봉오리를 지탱하기 위해 하반신이 강해진다. 양지에서 가만히 있는 시간이 길어지면 드디어 커다란 꽃이 필 때다.,つぼみを　ささえるため　あしこしが　つよくなる。 ひなたで　じっとする　じかんが　ながくなれば いよいよ　たいりんの　はなが　さくころだ。
There is a large flower on Venusaur’s back. The flower is said to take on vivid colors if it gets plenty of nutrition and sunlight. The flower’s aroma soothes the emotions of people.,Une belle fleur se trouve sur le dos de Florizarre. Elle prend une couleur vive lorsqu’elle est bien nourrie et bien ensoleillée. Le parfum de cette fleur peut apaiser les gens.,C’è un grande fiore sulla schiena di Venusaur. Si dice che i colori diventino più vividi con il giusto nutrimento e i raggi solari. Il suo profumo calma le reazioni emotive delle persone.,"Bisaflor hat eine Blume auf seinem Rücken. Wenn sie viel Nahrung und Sonne aufnimmt, verfärbt sie sich bunt. Der Duft der Blume besänftigt die Gemüter der Menschen.","Venusaur tiene una flor enorme en el lomo que, según parece, adquiere unos colores muy vivos si está bien nutrido y le da mucho el sol. El aroma delicado de la flor tiene un efecto relajante en el ánimo de las personas.",충분한 영양분과 태양의 빛이 꽃의 색을 선명하게 만든다고 한다. 꽃의 향기는 사람의 마음을 치유한다.,じゅうぶんな　えいようと　たいようの　ひかりが はなの　いろを　あざやかに　すると　いわれる。 はなの　かおりは　ひとの　こころを　いやす。
"The flame that burns at the tip of its tail is an indication of its emotions. The flame wavers when Charmander is enjoying itself. If the Pokémon becomes enraged, the flame burns fiercely.","La flamme qui brûle au bout de sa queue indique l’humeur de ce Pokémon. Elle vacille lorsque Salamèche est content. En revanche, lorsqu’il s’énerve, la flamme prend de l’importance et brûle plus ardemment.","La fiamma sulla punta della coda indica il suo stato emotivo. Se la fiamma ondeggia significa che Charmander si sta divertendo. Quando il Pokémon si infuria, la fiamma arde violentemente.","Die Flamme auf seiner Schweifspitze zeigt seine Gefühlslage an. Sie flackert, wenn Glumanda zufrieden ist. Wenn dieses Pokémon wütend wird, lodert die Flamme sehr stark.",La llama que tiene en la punta de la cola arde según sus sentimientos. Llamea levemente cuando está alegre y arde vigorosamente cuando está enfadado.,꼬리의 불꽃은 기분을 표현한다. 즐거울 때는 흔들흔들 불꽃이 흔들리고 화가 났을 때는 활활 맹렬히 불타오른다.,しっぽの　ほのおは　きぶんを　ひょうげん。 たのしい　ときには　ゆらゆら　ほのおが　ゆれて おこった　ときには　めらめら　さかんに　もえる。
"Charmeleon mercilessly destroys its foes using its sharp claws. If it encounters a strong foe, it turns aggressive. In this excited state, the flame at the tip of its tail flares with a bluish white color.","Reptincel lacère ses ennemis sans pitié grâce à ses griffes acérées. S’il rencontre un ennemi puissant, il devient agressif et la flamme au bout de sa queue s’embrase et prend une couleur bleu clair.",Charmeleon distrugge il nemico senza pietà con i suoi artigli affilati. Quando incontra un avversario molto forte diventa aggressivo. In questo stato di grande agitazione la fiamma della coda diventa di colore bianco bluastro.,"Glutexo attackiert seine Feinde mit aller Gewalt und unter Einsatz seiner scharfen Krallen. Trifft es auf starke Gegner, wird es wütend und die Flamme auf seiner Schweifspitze flackert in einem bläulichen Ton.","Charmeleon no tiene reparo en acabar con su rival usando las afiladas garras que tiene. Si su enemigo es fuerte, se vuelve agresivo, y la llama que tiene en el extremo de la cola empieza a arder con mayor intensidad tornándose azulada.",날카로운 발톱으로 봐주지 않고 때려눕힌다. 강한 적을 만나면 기분이 고양되며 꼬리의 불꽃이 푸르스름하게 불타오른다.,するどい　ツメで　ようしゃなく　たたきのめす。 きょうてきと　むかいあうと　きぶんが　たかぶり しっぽの　ほのおが　あおじろく　もえあがる。
"Charizard flies around the sky in search of powerful opponents. It breathes fire of such great heat that it melts anything. However, it never turns its fiery breath on any opponent weaker than itself.",Dracaufeu parcourt les cieux pour trouver des adversaires à sa mesure. Il crache de puissantes flammes capables de faire fondre n’importe quoi. Mais il ne dirige jamais son souffle destructeur vers un ennemi plus faible.,"Charizard solca i cieli in cerca di nemici molto forti. Riesce a emettere fiammate di un calore tale da fondere ogni cosa. Tuttavia, non rivolge mai le sue micidiali lingue di fuoco contro avversari più deboli di lui.","Glurak fliegt durch die Lüfte, um starke Gegner aufzuspüren. Sein heißer Feueratem bringt alles zum Schmelzen. Aber es richtet seinen Feueratem nie gegen schwächere Gegner.","Charizard se dedica a volar por los cielos en busca de oponentes fuertes. Echa fuego por la boca y es capaz de derretir cualquier cosa. No obstante, si su rival es más débil que él, no usará este ataque.",강한 상대를 찾아 하늘을 날아다닌다. 무엇이든 다 녹여버리는 고열의 불꽃을 자신보다 약한 자에게 들이대지 않는다.,つよい　あいてを　もとめて　そらを　とびまわる。 なんでも　とかして　しまう　こうねつの　ほのおを じぶんより　よわいものに　むけることは　しない。
"Squirtle’s shell is not merely used for protection. The shell’s rounded shape and the grooves on its surface help minimize resistance in water, enabling this Pokémon to swim at high speeds.",La carapace de Carapuce ne sert pas qu’à le protéger. La forme ronde de sa carapace et ses rainures lui permettent d’améliorer son hydrodynamisme. Ce Pokémon nage extrêmement vite.,La corazza di Squirtle non serve soltanto da protezione. La particolare forma arrotondata e le scanalature superficiali lo aiutano a minimizzare l’attrito dell’acqua per nuotare ad alta velocità.,"Schiggys Panzer dient nicht nur zum Schutz. Die runde Form und die Furchen auf der Oberfläche verringern den Widerstand im Wasser, sodass dieses Pokémon sehr schnell schwimmen kann.",El caparazón de Squirtle no le sirve de protección únicamente. Su forma redondeada y las hendiduras que tiene le ayudan a deslizarse en el agua y le permiten nadar a gran velocidad.,등껍질의 역할은 몸을 지키는 것뿐만이 아니다. 둥그런 모양과 표면의 홈이 물의 저항을 줄여서 빠르게 헤엄칠 수 있다.,こうらの　やくめは　みを　まもる　だけではない。 まるい　かたちと　ひょうめんの　みぞが　みずの ていこうを　へらすので　はやく　およげるのだ。
"Its tail is large and covered with a rich, thick fur. The tail becomes increasingly deeper in color as Wartortle ages. The scratches on its shell are evidence of this Pokémon’s toughness as a battler.",Carabaffe a une large queue recouverte d’une épaisse fourrure. Elle devient de plus en plus foncée avec l’âge. Les éraflures sur la carapace de ce Pokémon témoignent de son expérience au combat.,"La grande coda di Wartortle è coperta da una folta pelliccia, che diventa sempre più scura con l’avanzare dell’età. I graffi sulla corazza indicano la potenza di questo Pokémon come lottatore.","Schillok hat einen langen, buschigen Schweif, dessen Farbe intensiver wird, wenn es altert. Die Kratzer auf seinem Panzer zeugen von seiner Kampfkraft.",Tiene una cola larga y cubierta de un pelo abundante y grueso que se torna más oscuro a medida que crece. Los arañazos que tiene en el caparazón dan fe de lo buen guerrero que es.,푹신한 털로 덮인 큰 꼬리는 오래 살수록 깊은 색으로 변한다. 등껍질의 상처는 강자임을 증명한다.,ふさふさの　けで　おおわれた　おおきな　しっぽは ながいき　するほど　ふかい　いろあいに　かわる。 こうらの　キズは　つわものの　あかし。
Blastoise has water spouts that protrude from its shell. The water spouts are very accurate. They can shoot bullets of water with enough accuracy to strike empty cans from a distance of over 160 feet.,Tortank dispose de canons à eau émergeant de sa carapace. Ils sont très précis et peuvent envoyer des balles d’eau capables de faire mouche sur une cible située à plus de 50 m.,Blastoise è dotato di cannoni ad acqua che fuoriescono dalla corazza. I getti emessi sono così precisi da riuscire a colpire un bersaglio a una distanza di 50 m.,"Turtok besitzt Wasserdüsen, die aus seinem Panzer herausragen. Diese sind sehr präzise. Es kann Wassergeschosse so genau verschießen, dass es damit aus fast 50 m leere Dosen trifft.",Blastoise lanza chorros de agua con gran precisión por los tubos que le salen del caparazón que tiene en la espalda. Puede disparar chorros de agua con tanta puntería que no fallaría al tirar contra una lata pequeña a 50 m.,등껍질의 분사구로 하는 조준은 정확하다. 물 탄환으로 50m 떨어진 빈 캔을 명중시킬 수 있다.,こうらの　ふんしゃこうの　ねらいは　せいかく。 みずの　だんがんを　５０メートル　はなれた あきかんに　めいちゅうさせる　ことが　できるぞ。
"Perhaps because it would like to grow up quickly, it has a voracious appetite, eating a hundred leaves a day.",C’est peut-être parce qu’il a envie de grandir le plus vite possible qu’il est si vorace. Il engloutit une centaine de feuilles par jour.,Mangia 100 foglie al giorno. La sua voracità potrebbe essere dovuta al desiderio di crescere in fretta.,Das nimmersatte Raupy verschlingt 100 Blätter am Tag. Vermutlich strebt es so ein schnelleres Wachstum an.,"Muestra un apetito voraz, debido quizás a sus ganas de acelerar su desarrollo. Puede llegar a devorar un centenar de hojas al día.",빨리 성장하고 싶어서인지 식욕이 왕성하여 하루에 100장의 잎사귀를 먹는다.,はやく　せいちょう　したいのか 　しょくよくおうせいで　１にちに 　１００まいの　はっぱを　くらう。
Its shell is filled with a thick liquid. All of the cells throughout its body are being rebuilt in preparation for evolution.,Sa carapace contient un liquide gluant. Sa structure cellulaire est en cours de modification en vue de son évolution prochaine.,La sua corazza contiene un liquido vischioso. Ristruttura tutte le cellule del suo corpo preparandosi all’evoluzione.,Sein Panzer birgt ein dickflüssiges Inneres. In Vorbereitung auf seine Entwicklung wird seine Zellstruktur vollständig umgestaltet.,El interior del caparazón es un líquido viscoso. Todas las células de su cuerpo se están regenerando en preparación para su evolución.,껍질 안은 걸쭉한 액체다. 진화를 대비하여 몸 전체의 세포를 재구성하고 있다.,カラのなかは　ドロドロの　えきたい。 　しんかに　そなえて　からだじゅうの 　さいぼうを　つくりなおしている。
"Its wings are covered in toxic scales. If it finds bird Pokémon going after Caterpie, Butterfree sprinkles its scales on them to drive them off.","Lorsqu’il surprend un Pokémon oiseau attaquant un Chenipan, il répand les écailles très toxiques qui recouvrent ses ailes sur l’assaillant.","Se vede dei Pokémon alati attaccare Caterpie, li scaccia cospargendoli con la velenosissima  polvere che ricopre le sue ali.","Sieht es ein Raupy, das von Vogel-Pokémon angegriffen wird, schlägt es diese mit seinem hochgiftigen Flügelstaub in die Flucht.","Si un Pokémon pájaro acecha a un Caterpie, Butterfree esparcirá las escamas venenosas que recubren sus alas para ahuyentarlo.",날개를 감싼 인분은 맹독이다. 캐터피를 노리는 새포켓몬을 발견하면 흩뿌려 내쫓는다.,ハネを　つつむ　りんぷんは　もうどく。 　キャタピーを　ねらう　とりポケモンを 　みつけると　ふりかけて　おいはらうぞ。
Weedle has an extremely acute sense of smell. It is capable of distinguishing its favorite kinds of leaves from those it dislikes just by sniffing with its big red proboscis (nose).,L’odorat d’Aspicot est extrêmement développé. Il lui suffit de renifler ses feuilles préférées avec son gros appendice nasal pour les reconnaître entre mille.,Weedle ha un senso dell’olfatto estremamente sviluppato. Riesce a distinguere le sue foglie preferite da quelle che lo disgustano semplicemente annusandole con il grande naso rosso.,"Hornliu verfügt über einen ausgezeichneten Geruchssinn. Es ist in der Lage, seine Lieblingsblätter von denen zu unterscheiden, die es nicht mag, indem es mit seinem großen roten Rüssel daran schnuppert.",Weedle tiene un finísimo sentido del olfato. Es capaz de distinguir las hojas que le gustan de las que no le gustan olisqueando un poco con la gran nariz que tiene.,굉장히 예민한 후각을 지니고 있다. 좋아하는 잎사귀인지 싫어하는 잎사귀인지 크고 빨간 코로 냄새 맡아 구별한다.,とても　するどい　きゅうかくを　もっている。 こうぶつの　はっぱか　きらいな　はっぱか おおきな　あかい　はなで　かぎわける。
"Kakuna remains virtually immobile as it clings to a tree. However, on the inside, it is extremely busy as it prepares for its coming evolution. This is evident from how hot the shell becomes to the touch.","Coconfort est la plupart du temps immobile et reste accroché à un arbre. Cependant, intérieurement, il est très actif, car il se prépare pour sa prochaine évolution. En touchant sa carapace, on peut sentir sa chaleur.","Kakuna rimane praticamente immobile abbarbicato agli alberi. Tuttavia, internamente è intento a preparare la sua futura evoluzione. Lo si può capire dall’intensità del calore sviluppato dal guscio.","Kokuna bewegt sich kaum, wenn es sich an einen Baum heftet. In seinem Inneren jedoch regt sich einiges, da es sich auf seine bevorstehende Entwicklung vorbereitet. Dabei wird seine Schale sehr heiß.","Kakuna permanece prácticamente inmóvil al encaramarse a los árboles, aunque la actividad interna de su organismo tiene un ritmo frenético, pues se prepara para su evolución. Prueba de esto es la alta temperatura de su caparazón.",거의 움직이지 않고 나무에 매달려 있지만 내부는 진화 준비로 굉장히 바쁜 상태다. 그 증거로 몸이 뜨거워져 있다.,ほとんど　うごかず　きに　つかまっているが なかでは　しんかの　じゅんびで　おおいそがし。 その　しょうこに　からだが　あつくなっているぞ。
"Beedrill is extremely territorial. No one should ever approach its nest—this is for their own safety. If angered, they will attack in a furious swarm.","Dardargnan est extrêmement possessif. Il vaut mieux ne pas toucher son nid si on veut éviter d’avoir des ennuis. Lorsqu’ils sont en colère, ces Pokémon attaquent en masse.","Beedrill difende strenuamente il proprio territorio. Per ragioni di sicurezza nessuno può avvicinarsi al suo nido. Se vengono disturbati, questi Pokémon attaccano violentemente in sciami.","Bibor ist sehr wehrhaft. Es sollte sich besser niemand seinem Nest nähern. Wenn man sie ärgert, greifen sie in Schwärmen an.","Los Beedrill defienden su territorio a toda costa. No es conveniente acercarse a su colmena, por seguridad. Si se les molesta, todo un enjambre atacará ferozmente.",영역에 대한 집착이 매우 강해서 독침붕이 사는 곳에는 가까이 가지 않는 것이 신상에 좋다. 화나면 집단으로 습격해 온다.,なわばりいしきが　とても　つよいので　スピアーの すみかには　ちかづかない　ほうが　みの　ためだ。 おこると　しゅうだんで　おそって　くるぞ。
"Pidgey has an extremely sharp sense of direction. It is capable of unerringly returning home to its nest, however far it may be removed from its familiar surroundings.","Roucool a un excellent sens de l’orientation. Il est capable de retrouver son nid sans jamais se tromper, même s’il est très loin de chez lui et dans un environnement qu’il ne connaît pas.","Pidgey ha un senso dell’orientamento molto sviluppato. È sempre in grado di ritornare al suo nido, anche quando si spinge molto lontano dal suo ambiente abituale.","Taubsi verfügt über einen sehr geschulten Orientierungssinn. Es kehrt zielsicher zu seinem Nest zurück, egal, wie weit es sich von seiner gewohnten Umgebung entfernt hat.","Pidgey tiene un sentido de la orientación muy desarrollado. Es capaz de regresar a su nido, por lejos que se encuentre de las zonas que le resultan familiares.",방향 감각이 매우 뛰어나서 아무리 멀리 떨어진 곳에서도 헤매지 않고 자신의 둥지까지 찾아 돌아올 수 있다.,ほうこう　かんかくに　とても　すぐれているので どんなに　はなれた　ばしょからでも　まよわずに じぶんの　す　まで　かえる　ことが　できる。
"Pidgeotto claims a large area as its own territory. This Pokémon flies around, patrolling its living space. If its territory is violated, it shows no mercy in thoroughly punishing the foe with its sharp claws.","Roucoups utilise une vaste surface pour son territoire. Ce Pokémon surveille régulièrement son espace aérien. Si quelqu’un pénètre sur son territoire, il corrige l’ennemi sans pitié d’un coup de ses terribles serres.","Pidgeotto delimita come proprio un territorio immenso, che difende controllandolo costantemente. Se tale territorio viene invaso, questo Pokémon non ha pietà nel punire i nemici con i suoi artigli affilati.","Tauboga nennt ein großes Gebiet sein Eigen. Es fliegt umher und kontrolliert seinen Lebensraum. Wenn jemand sein Gebiet betritt, zeigt es keine Gnade und greift seine Gegner mit seinen scharfen Krallen an.","Pidgeotto se apodera de una zona muy vasta como su territorio y la sobrevuela para controlarla. Si alguien invade su espacio vital, no tendrá ningún reparo en castigarlo con sus afiladas garras.",넓은 영역을 날며 순찰한다. 영역을 침범하는 상대는 용서하지 않는다. 날카로운 발톱으로 철저히 혼내준다.,ひろい　なわばりを　とんで　みまわりを　する。 なわばりを　あらす　あいては　ようしゃ　しない。 するどい　ツメで　てっていてきに　こらしめるぞ。
"This Pokémon has a dazzling plumage of beautifully glossy feathers. Many Trainers are captivated by the striking beauty of the feathers on its head, compelling them to choose Pidgeot as their Pokémon.",Ce Pokémon est doté d’un plumage magnifique et luisant. Bien des Dresseurs sont captivés par la beauté fatale de sa huppe et décident de choisir Roucarnage comme leur Pokémon favori.,Questo Pokémon è caratterizzato da uno stupendo piumaggio dai colori vivaci e brillanti. Molti Allenatori sono colpiti dall’evidente bellezza delle piume sulla testa. Per questo spesso scelgono Pidgeot come loro Pokémon.,"Dieses Pokémon hat ein wunderschönes, glänzendes Gefieder. Viele Trainer sind von der auffälligen Schönheit seines Federkleids begeistert, sodass sie Tauboss als ihr Pokémon wählen.",El plumaje de este Pokémon es bonito e hipnótico. Muchos Entrenadores se quedan embobados ante la belleza impactante de las plumas que tiene en la cabeza; lo que les lleva a elegir a Pidgeot como su Pokémon.,아름답게 윤이 나는 깃털을 가진 포켓몬이다. 머리 깃털의 아름다움에 마음을 빼앗겨 피죤투를 기르는 트레이너도 많다.,うつくしい　こうたくの　はねを　もつ　ポケモン。 あたまの　はねの　うつくしさに　こころ　うばわれ ピジョットを　そだてる　トレーナーも　おおい。
"Its incisors grow continuously throughout its life. If its incisors get too long, this Pokémon becomes unable to eat, and it starves to death.","Ses incisives poussent tout au long de sa vie. Si elles dépassent une certaine longueur, il ne peut plus s’alimenter et meurt de faim.","I suoi incisivi continuano a crescere per tutta la vita. Se si allungano troppo, non riesce più a nutrirsi e muore di fame.","Seine Nagezähne wachsen sein ganzes Leben über. Werden sie allzu lang, kann es damit nicht mehr fressen und verhungert.","Sus incisivos crecen durante toda su vida. Si aumentan demasiado de tamaño, no puede alimentarse y muere de inanición.",평생 앞니가 계속 자란다. 너무 많이 자라면 먹이를 먹을 수 없어 굶어 죽는다.,いっしょう　まえばが　のびつづける。 　あまりに　のびすぎると　エサが 　たべられなくなって　がし　する。
People say that it fled from its enemies by using its small webbed hind feet to swim from island to island in Alola.,Les petites palmes de ses pattes postérieures lui permettraient de se rendre d’île en île à la nage afin d’échapper à ses prédateurs.,Si dice che sia sfuggito ai nemici nuotando da un’isola all’altra grazie alle minuscole membrane tra le dita delle zampe posteriori.,"Auf der Flucht vor seinen Feinden nutzt es die Schwimmhäute an seinen Hinterläufen, um von Insel zu Insel zu schwimmen.",Las pequeñas membranas que tiene en las patas traseras le permiten nadar entre las islas de Alola y escapar así de sus depredadores.,뒷발의 작의 물갈퀴로 바다를 헤엄쳐 섬을 건너 적을 피해 도망쳤다고 한다.,うしろあしの　ちいさい　みずかきで 　うみを　およいで　しまを　わたり 　てきから　にげていた　という。
Its reckless nature leads it to stand up to others—even large Pokémon—if it has to protect its territory.,Un Pokémon téméraire qui n’hésite pas à affronter des Pokémon plus gros que lui pour protéger son territoire.,"Temerario di natura, per difendere il proprio territorio non esita a lanciarsi anche contro avversari più grandi di lui.","Wenn es um die Verteidigung seines Reviers geht, schreckt das draufgängerische Habitak selbst vor großen Pokémon nicht zurück.",Su temperamento temerario hace que no dude en enfrentarse a rivales mucho más grandes a la hora de defender su territorio.,자신의 영역을 지키기 위해서라면 상대가 큰 포켓몬이라도 덤벼드는 무모한 성질을 가졌다.,じぶんのテリトリーを　まもるためなら 　おおきな　ポケモンが　あいてでも 　むかっていく　むこうみずな　せいしつ。
