en,fr,it,de,es,ko,kana
It is told in mythology that this Pokémon was born before the universe even existed.,"Dans la mythologie, ce Pokémon existait déjà avant la formation de l’univers.",Nei racconti mitologici si dice che questo Pokémon sia nato ancor prima dell’universo.,"Die Mythologie erzählt, dass dieses Pokémon geboren wurde, bevor das Universum überhaupt existierte.",La mitología cuenta que este Pokémon nació antes de que el Universo existiera.,우주가 아직 생기지 않았을 무렵에 처음으로 태어난 포켓몬이라고 신화 속에서 묘사된다.,うちゅうが　まだ　ない　ころに さいしょに　うまれた　ポケモンと しんわの　なかで　かたられている。
"When it shares the infinite energy it creates, that being’s entire body will be overflowing with power.",L’énergie sans limites qu’il produit donne une force incroyable à ceux qui entrent en contact avec elle.,"Può condividere l’energia infinita che emana, donando un potere immenso a chi la riceve.","Jeder, dem Victini seine grenzenlose Energie zuteilwerden lässt, strotzt nur so vor Kraft.","Cuando Victini comparte su energía ilimitada, esa persona o Pokémon irradia abundante poder.",비크티니가 무한히 만들어내는 에너지를 나누어 받으면 전신에 파워가 넘친다.,ビクティニが　むげんに　うみだす エネルギーを　わけあたえてもらうと ぜんしんに　パワーが　あふれだす。
"They photosynthesize by bathing their tails in sunlight. When they are not feeling well, their tails droop.","Il laisse sa queue prendre le soleil pour sa photosynthèse. Quand il est malade, sa queue pend tristement.","Assorbe i raggi solari dalla coda per operare la fotosintesi. Quando non sta bene, la sua coda si affloscia.","Fängt mit dem Schweif Sonnenlicht auf, um Photosynthese zu betreiben. Fehlt ihm die Kraft, hängt sein Schweif schlaff herab.",Sintetiza la luz del sol que recoge con su cola. Esta se le queda abatida cuando le fallan las energías.,꼬리로 태양의 빛을 받아 광합성한다. 기운이 빠지면 꼬리가 축 늘어진다.,しっぽで　たいようを　あびて こうごうせいを　する。げんきを なくすと　しっぽが　たれさがる。
"When it gets dirty, its leaves can’t be used in photosynthesis, so it always keeps itself clean.","La saleté l’empêchant d’utiliser la photosynthèse, il prend grand soin d’être toujours propre.","Se si sporca, le sue foglie non possono più effettuare la fotosintesi, perciò si tiene sempre molto pulito.","Es achtet stets auf Reinlichkeit, da es mit schmutzigen Blättern keine Photosynthese betreiben kann.","Cuando su cuerpo está sucio, no puede realizar la fotosíntesis con sus hojas, así que cuida mucho su higiene personal.",몸이 더러워지면 잎으로 광합성을 할 수 없기 때문에 항상 청결하게 하고 있다.,からだが　よごれると　はっぱで こうごうせいが　できなくなるので いつも　せいけつに　している。
It can stop its opponents’ movements with just a glare. It takes in solar energy and boosts it internally.,Il peut paralyser l’ennemi d’un regard. Il amplifie l’énergie du soleil dans son corps.,Può bloccare i movimenti dell’avversario con il solo sguardo. Amplifica l’energia solare all’interno del suo corpo.,Bringt Gegner mit einem einzigen kühlen Blick zum Erstarren. In seinem Inneren verstärkt es die Energie der Sonne.,Detiene los movimientos del rival con una sola mirada. Expande la energía solar dentro de su cuerpo.,째려보기만 해도 상대의 움직임을 멈추게 한다. 태양에너지를 체내에서 증폭시킨다.,にらむだけで　あいての　うごきを とめてしまう。たいようエネルギーを たいないで　ぞうふくさせる。
"It loves to eat roasted berries, but sometimes it gets too excited and burns them to a crisp.","Il adore se goinfrer de Baies grillées, mais il lui arrive de les réduire en cendres dans son excitation.","Adora mangiare le bacche arrostite, ma a volte si fa prendere la mano per l’eccitazione e le riduce in cenere.","Floink liebt es, selbst geröstete Nüsse zu verspeisen. Ab und zu verkohlt es sie jedoch ungewollt vor lauter Vorfreude.","Le encanta comer bayas tostadas, pero a veces se emociona demasiado y termina churruscándolas.",구운 나무열매를 먹는 것을 매우 좋아하지만 너무 흥분해서 가끔 새까맣게 태워버린다.,やいた　きのみを　たべるのが だいすきだが　こうふんしすぎて ときどき　まっくろこげに　しちゃう。
"When its internal fire flares up, its movements grow sharper and faster. When in trouble, it emits smoke.","Quand le feu dans son corps s’embrase, sa vitesse et son agilité augmentent. En cas d’urgence, il crache de la fumée.","Quando la fiamma interna arde intensa, diventa più rapido e scattante. Nei momenti critici esala fumo.","Lodert das Feuer in ihm auf, bewegt es sich geschmeidiger und schneller. Bei Gefahr lässt es ordentlich Dampf ab.","Cuando las llamas de su interior se avivan, aumenta su velocidad y agilidad. Emite humo si está en peligro.",체내의 불꽃이 타오르면 움직임이 더 빠르고 예리해진다. 위급해지면 연기를 뿜어낸다.,たいないの　ほのおが　もえあがると うごきの　キレと　スピードが　ます。 ピンチになると　けむりを　ふきだす。
It has mastered fast and powerful fighting moves. It grows a beard of fire.,Il a une barbe enflammée. Il maîtrise des techniques de combat au corps à corps rapides et puissantes.,La sua barba è avvolta dalle fiamme. Padroneggia mosse di lotta che combinano potenza e rapidità.,"Es trägt einen Backenbart aus Feuer und beherrscht Kampftechniken, die ebenso wuchtig wie schnell sind.","Posee una tupida barba fogosa. Es tanto rápido como poderoso, y su principal baza es la lucha cuerpo a cuerpo.",불꽃 턱수염을 기르고 있다. 파워와 스피드를 겸비한 격투 기술을 익히고 있다.,ほのおの　あごひげを　たくわえる。 パワーと　スピードを　かねそなえた かくとうの　わざを　みにつけている。
"It fights using the scalchop on its stomach. In response to an attack, it retaliates immediately by slashing.",Il combat avec le coupillage de son ventre. Il peut parer un assaut et immédiatement contre-attaquer.,Combatte con la conchiglia che ha sul ventre. Contrattacca prontamente dopo aver parato l’attacco avversario.,"Kämpft mit der Muschel auf seinem Bauch. Pariert es einen Angriff, schlägt es sofort mit einer Schnitt-Attacke zurück.","Ataca con la vieira de su ombligo. En cuanto para un ataque, pasa al contraataque sin dilación.",배에 있는 가리비칼로 싸운다. 공격을 막고 그 즉시 베어 반격한다.,おなかの　ホタチで　たたかう。 こうげきを　うけとめてから　すかさず きりつけて　はんげきするのだ。
"As a result of strict training, each Dewott learns different forms for using the scalchops.","Chaque Mateloutre a sa propre technique d’escrime au coupillage, acquise grâce à un entraînement drastique.",Le loro conchiglie sono tutte diverse nella forma e ogni Dewott si allena duramente per imparare a usarle.,Jedes Zwottronin eignet sich über strenges Training einen völlig eigenen Muschelkampfstil an.,"Tras un exhaustivo entrenamiento, Dewott puede dominar diversas técnicas para usar con sus vieiras.",혹독한 수행 끝에 쌍검자비마다 다른 형태의 가리비칼 다루는 기술을 습득한다.,きびしい　しゅぎょうの　すえ フタチマルごとに　ことなる　かたの ホタチさばきを　しゅうとく　する。
One swing of the sword incorporated in its armor can fell an opponent. A simple glare from one of them quiets everybody.,"Il peut terrasser ses ennemis d’un coup de la lame enchâssée dans son armure, et les faire taire d’un seul regard.",Atterra l’avversario con un solo colpo della spada inserita nell’armatura. Una sua occhiata ammutolisce il nemico.,Besiegt Gegner durch einen einzigen Hieb mit der Klinge an seinem Panzer. Ein böser Blick und seine Feinde verstummen.,Derriba a su rival con un solo tajo del sable que lleva en su coraza. Acalla al enemigo con una simple mirada.,갑옷에 내장된 검으로 한칼에 상대를 제압한다. 눈빛만으로 상대를 침묵시킨다.,よろいに　しこまれた　つるぎの ひとふりで　あいてを　たおす。 ひとにらみで　てきを　だまらせる。
"Extremely cautious, one of them will always be on the lookout, but it won’t notice a foe coming from behind.","Très prudent, il surveille attentivement son territoire, mais oublie souvent de regarder derrière lui.",Sono molto guardinghi e almeno uno del branco è sempre di guardia. Non vedono però il nemico se li attacca da dietro.,"Eines dieser vorsichtigen Pokémon steht immer vor ihrem Bau Wache. Nähert sich jedoch ein Feind von hinten, ist es aus.","Aunque es un Pokémon muy precavido y siempre hay uno montando guardia, si se acercan por detrás, no se dará cuenta.",경계심이 강해서 반드시 한 마리는 망을 보고 있으나 뒤에서 오는 상대는 알아차리지 못한다.,けいかいしんが　つよく　かならず いっぴきは　みはりを　しているのだが うしろからの　てきには　きづかない。
"When they see an enemy, their tails stand high, and they spit the seeds of berries stored in their cheek pouches.","Il attaque en crachant les graines des Baies qu’il accumule dans ses bajoues. S’il voit un ennemi, il dresse la queue.","Attacca sparando i semi delle bacche che ha accumulato nelle guance. Se avvista il nemico, drizza la coda.","Bespuckt Gegner mit Kernen von Beeren aus seinen Backentaschen. Erspäht es einen Feind, richtet es den Schweif auf.",Ataca lanzando las semillas de las bayas que acumula en sus mofletes. Su cola se tensa al avistar a un enemigo.,뺨의 주머니에 모아둔 나무열매의 씨앗을 날려서 공격한다. 적을 발견하면 꼬리를 세운다.,ほっぺの　ふくろに　ためた　きのみの タネを　とばして　こうげき。てきを はっけんすると　しっぽを　たてる。
"This Pokémon has excellent judgment. If it decides it can’t defeat an opponent, it immediately turns tail and vamooses.","Réputé pour sa grande perspicacité, il s’enfuit la queue entre les pattes s’il s’estime trop faible pour gagner.","È molto perspicace e capisce al volo se può competere con l’avversario. Se sa di non poterlo battere, fugge con la coda fra le gambe.","Ein Pokémon mit ausgeprägtem Urteilsvermögen. Befindet es seinen Gegner für zu stark, zieht es den Schwanz ein und sucht sofort das Weite.","Este Pokémon destaca por su perspicacia. Si percibe que no lleva las de ganar, no duda en huir con el rabo entre las piernas.",판단력이 뛰어난 포켓몬. 이길 수 없는 상대라고 판단되면 바로 꼬리를 내리고 도망친다.,はんだんりょくに　すぐれた　ポケモン。 　かてない　あいてと　はんだんしたら 　さっさと　シッポを　まいて　にげる。
"The longer its black fur grows, the harder and more impervious it gets. Claws and fangs can’t easily penetrate it.",Son pelage sombre devient si robuste au fil du temps que même des crocs ou des griffes peinent à passer au travers.,La pelliccia scura diventa più dura e resistente con la crescita e lo difende dagli artigli e dalle zanne dei nemici.,"Mit zunehmendem Alter wird sein dunkles Fell immer widerstandsfähiger, sodass selbst Klauen und Fangzähne es kaum durchdringen können.","Con el paso del tiempo, su oscuro pelaje se vuelve duro y resistente, lo que le sirve como ligera protección contra colmillos y cuernos.",검은 털은 자랄수록 딱딱하고 튼튼해져 발톱이나 이빨로도 쉽게 뚫을 수 없다.,くろい　たいもうは　そだつほど 　かたく　じょうぶに　なって　ツメや 　キバも　かんたんには　とおさないぞ。
"It pays no mind to the cold, thanks to its long warm coat. Stoutland in Alola look a little uncomfortable.","Son long pelage le protège parfaitement du froid. Malheureusement pour lui, cela n’est pas très utile à Alola.","Non teme il freddo grazie al manto lungo e caldo. Gli Stoutland che vivono ad Alola, però, sembrano soffrire un po’ il caldo.","Dank seines langen, warmen Fells kann ihm die Kälte nichts anhaben. In Alola hat es daher leider mit dem schwülen Klima zu kämpfen.","El largo y cálido pelaje le permite soportar sin ningún problema el frío, pero resulta un poco asfixiante en Alola.",길고 따듯한 털 덕분에 추위는 걱정 없다. 알로라의 바랜드는 조금 괴로운 것 같다.,ながく　あたたかい　けの　おかげで 　さむさは　へっちゃら。　アローラの 　ムーランドは　すこし　くるしそうだ。
"They steal from people for fun, but their victims can’t help but forgive them. Their deceptively cute act is perfect.","Il vole les gens pour le plaisir, mais il est tellement mignon que ses victimes finissent toujours par lui pardonner.","Ruba per gioco le cose alle persone, ma è talmente tenero che finiscono tutti per perdonarlo.","Es stibitzt den Leuten spaßeshalber ihr Hab und Gut, doch dank seiner reizenden Natur kann ihm niemand lang böse sein.","Hurta a los humanos por mera diversión, pero las víctimas lo perdonan al ver a este Pokémon tan encantador.",다른 사람의 물건을 장난삼아 훔친다. 물건을 도둑맞은 사람도 애교 넘치는 행동에 빠져 용서하고 만다.,ひとの　ものを　あそびで　ぬすむ。 ぬすまれた　ひとも　あいくるしい しぐさに　つい　ゆるしてしまうのだ。
"Stealthily, it sneaks up on its target, striking from behind before its victim has a chance to react.",Il s’approche sans un bruit de sa proie et l’abat d’un coup par-derrière sans jamais être repéré.,Si avvicina di soppiatto alle spalle del nemico colpendolo prima che se ne accorga.,"Verbirgt seine Aura und nähert sich seinem Gegner völlig unbemerkt von hinten, um ihm den Garaus zu machen.","Se aproxima evitando que lo detecten. Con sigilo, se acerca a su rival por la espalda y lo ataca.",기척을 지우고 접근한다. 상대가 눈치채기 전에 뒤쪽으로 살며시 다가가 꼼짝 못하게 한다.,けはいを　ころして　せっきんする。 あいてが　きづく　まえに　はいごから しのびより　しとめてしまうのだ。
It’s good at finding berries and gathers them from all over. It’s kind enough to share them with friends.,Il est très doué pour trouver des Baies et aime les partager avec ses amis sans rien demander en échange.,"È un Pokémon molto generoso. Abilissimo nello scovare le bacche, va in giro a raccoglierle per poi condividerle.","Ein nettes Kerlchen, das so talentiert darin ist, Beeren aufzuspüren, dass es sie mit all seinen Kameraden teilt.",Es todo un experto en la búsqueda de bayas y es tan gentil que las comparte con todos sus compañeros.,나무열매를 잘 찾아 여기저기에서 모아 동료에게 나누어 주는 상냥함을 가졌다.,きのみを　さがすのが　じょうずで あちこちで　あつめて　なかまに わけあたえる　やさしさを　もつ。
"Ill tempered, it fights by swinging its barbed tail around wildly. The leaf growing on its head is very bitter.",Il a un tempérament violent et se bat avec sa queue pleine d’épines. La feuille sur sa tête est très amère.,"Di carattere impetuoso, lotta roteando la coda dotata di aculei. Le foglie che ha sul capo sono molto amare.","Ein hitziger Geselle, der im Kampf seinen dornigen Schweif umherschwingt. Auf seinem Kopf wachsen bittere Kräuter.",Pokémon muy temperamental que lucha con su cola revestida de púas. Las hojas de su cabeza están muy amargas.,기질이 격하여 가시가 박힌 꼬리를 휘두르며 싸운다. 머리의 잎사귀는 매우 쓰다.,きしょうが　はげしく　トゲの　ついた しっぽを　ふりまわして　たたかう。 あたまの　はっぱは　とても　にがい。
This Pokémon lives in caves in volcanoes. The fire within the tuft on its head can reach 600 degrees Fahrenheit.,Il vit dans les cratères des volcans. L’intérieur de la mèche qu’il a sur la tête peut atteindre 300 °C.,Vive nelle grotte vulcaniche. L’interno del ciuffo che ha in testa brucia a una temperatura di 300 °C.,Das Feuer in seinem Kopfbüschel erreicht Temperaturen von bis zu 300 °C. Es ist in Vulkanhöhlen zu Hause.,"Vive en cuevas volcánicas. El interior de su mata de pelo arde, llegando a alcanzar hasta 300 °C.",화산 동굴에서 산다. 머리의 송아리 속이 불타고 있어 300도나 되는 높은 온도가 된다.,かざんの　ほらあなで　くらす。 あたまの　ふさの　なかが　もえていて ３００どの　こうおんになる。
"When it gets excited, embers rise from its head and tail and it gets hot. For some reason, it loves sweets.","Quand il est excité, des flammèches brûlantes dansent sur sa tête et sa queue. Il raffole des choses sucrées.",Quando è concitato si scalda e iniziano a levarsi scintille dalla testa e dalla coda. Per qualche motivo adora i dolci.,"Freut es sich, erhitzt sich sein Körper und aus seinem Kopf und Schweif sprühen Funken. Es liebt Süßigkeiten.","Cuando se emociona, echa chispas por la cola y la cabeza, y calienta su cuerpo. Por alguna razón le encantan los dulces.",흥분하면 머리나 꼬리에서 불티가 날아올라 뜨거워진다. 왜인지 달콤한 것을 매우 좋아한다.,こうふんすると　あたまや　しっぽから ひのこが　まいあがって　あつくなる。 なぜか　あまいものが　だいこうぶつ。
The water stored inside the tuft on its head is full of nutrients. Plants that receive its water grow large.,L’eau contenue dans la mèche sur sa tête est pleine de nutriments. Elle fait pousser les plantes avec vigueur.,L’acqua accumulata nel ciuffo è ricca di nutrimento e fa crescere rigogliose le piante che ne vengono annaffiate.,"Das Wasser, das es im Büschel auf seinem Kopf sammelt, ist äußerst nahrhaft und verhilft Pflanzen zu großem Wachstum.","La acuosidad que acumula en su mata de pelo es rica en nutrientes, ideal para regar plantas y que crezcan mucho.",머리의 송아리에 모은 물은 영양이 가득하다. 식물에 뿌려주면 크게 자란다.,あたまの　ふさに　ためた　みずは えいよう　たっぷり。しょくぶつに かけると　おおきく　そだつのだ。
"It prefers places with clean water. When its tuft runs low, it replenishes it by siphoning up water with its tail.",Il aime les endroits où l’eau est pure. Il se ravitaille en eau en l’aspirant avec sa queue.,"Predilige i luoghi dove l’acqua è pura. Se l’acqua che ha sul capo diminuisce, ne aggiunge altra aspirandola con la coda.","Hält sich bevorzugt in reinen Gewässern auf. Geht ihm das Wasser in seinem Kopf aus, tankt es mit seinem Schweif nach.","Le encantan los lugares con agua limpia. Cuando desciende el nivel de agua de su pelo, se abastece a través de su cola.",물이 깨끗한 장소를 좋아한다. 머리에 모아둔 물이 줄어들면 꼬리에서 빨아올려 보급한다.,みずが　きれいな　ばしょを　このむ。 あたまに　ためこんだ　みずがへると しっぽから　すいあげて　ほきゅう。
"It eats the dreams of people and Pokémon. When it eats a pleasant dream, it expels pink-colored mist.","Il se nourrit des rêves des gens et des Pokémon. Quand le rêve est agréable, il crache une fumée rose.","Si nutre dei sogni di uomini e Pokémon. Se mangia sogni piacevoli, esala un fumo di colore rosa.","Es verschlingt die Träume der Menschen. Frisst es einen fröhlichen Traum, stößt es danach einen rosafarbenen Dunst aus.","Se alimenta de los sueños de humanos y Pokémon. Si los sueños son felices, despide humo rosa.",사람이나 포켓몬이 꾼 꿈을 먹는다. 즐거운 꿈을 먹으면 분홍색 연기를 뿜어낸다.,ひとや　ポケモンが　みた　ゆめを たべる。たのしい　ゆめを　たべると ピンクいろの　けむりを　はきだす。
The dream mist coming from its forehead changes into many different colors depending on the dream that was eaten.,La fumée qui sort de son front change de couleur selon le contenu des rêves qu’il a mangés.,Il fumo che esce dalla sua fronte cambia colore a seconda del contenuto del sogno che ha mangiato.,"Je nach Inhalt der Träume, die es frisst, nimmt der Dunst, der aus seiner Stirn austritt, unterschiedliche Farben an.",El color del humo que despide por su abultada frente varía según el contenido de los sueños que haya engullido.,이마에서 나오는 꿈연기는 먹은 꿈의 내용에 따라 여러 가지 색으로 변한다.,おでこから　でる　ゆめのけむりは たべた　ゆめの　ないようによって さまざまな　いろに　かわるのだ。
These Pokémon live in cities. They are accustomed to people. Flocks often gather in parks and plazas.,Ces Pokémon vivent en ville. Ils sont peu farouches et se regroupent souvent dans les parcs ou sur les places.,"Pokémon che vive in città. Si affeziona facilmente alle persone, perciò non è strano trovarlo in parchi o piazze.","Ein Pokémon, das in der Stadt zu Hause ist. Es ist sehr zutraulich und bevölkert in Scharen öffentliche Plätze und Parks.","Vive en la ciudad, pues se lleva muy bien con la gente. Le encantan los parques y las plazas, donde se reúne con otros.",거리에 사는 포켓몬이다. 사람을 잘 따라서 공원이나 광장에 많이 모인다.,まちなかで　くらしている　ポケモン。 ひとなつっこいので　こうえんや ひろばに　たくさん　あつまってくる。
"No matter where in the world it goes, it knows where its nest is, so it never gets separated from its Trainer.","Quel que soit le lieu où il se trouve, il arrive toujours à retrouver son Dresseur comme son propre nid.","Dovunque si trovi, è sempre in grado di ritrovare il suo nido. Allo stesso modo, non perde mai di vista il suo Allenatore.",Findet selbst von der anderen Seite des Globus zu seinem Nest zurück. Nichts kann es von seinem Trainer trennen.,Puede regresar sin problema alguno a su nido desde cualquier lugar del globo y jamás se separa de quien lo entrena.,세계 어디에 있어도 자신의 둥지가 있는 곳을 알 수 있어 트레이너를 잃어버리지 않는다.,せかいの　どこに　いても じぶんの　すの　ばしょは　わかるので トレーナーとも　はぐれたりしない。
Males have plumage on their heads. They will never let themselves feel close to anyone other than their Trainers.,Ils sont très farouches et ne s’attachent qu’à leur Dresseur. Les mâles ont une parure sur la tête.,"Il maschio ha una decorazione sulla fronte. Per indole, non si affeziona a nessuno tranne l’Allenatore.",Männliche Exemplare tragen eine Verzierung am Kopf. Lässt sich von Natur aus nur auf seinen Trainer ein.,El macho hace gala de ornamentación en la cabeza. No es dado a hacerse amigo de alguien que no sea su Entrenador.,수컷은 머리에 장식이 있다. 트레이너가 아닌 사람은 절대 따르지 않는 성질을 가졌다.,オスは　あたまに　かざりを　もつ。 トレーナー　いがいの　ひとには けっして　なつかない　せいしつ。
Its mane shines when it discharges electricity. They use the frequency and rhythm of these flashes to communicate.,Sa crinière luit quand il lâche des décharges. Il module leur rythme et leur nombre pour communiquer avec ses pairs.,Se emette scariche la sua criniera brilla. Comunica con i suoi simili tramite il ritmo e la frequenza delle pulsazioni luminose.,"Um mit Artgenossen zu kommunizieren, nutzt es das Aufblitzen seiner Mähne beim Entladen von Strom als Morsecode.",Su crin brilla cuando emite una descarga eléctrica. Se comunica con los suyos mediante el ritmo y el número de brillos.,방전하면 갈기가 빛난다. 갈기가 빛나는 횟수나 리듬으로 동료와 대화한다.,ほうでんすると　たてがみが　ひかる。 たてがみが　かがやく　かいすうや リズムで　なかまと　かいわしている。
"They have lightning-like movements. When Zebstrika run at full speed, the sound of thunder reverberates.","Il réagit à la vitesse de l’éclair. Lorsqu’il est en plein galop, on peut entendre le grondement du tonnerre.","È scattante come una saetta. Se corre alla massima velocità, si sente un rimbombo di tuoni.","Es ist explosiv wie ein Blitz. Galoppiert es mit voller Geschwindigkeit drauflos, kann man Donnerhall vernehmen.","Su velocidad se asemeja a la de un rayo. Si corre al máximo, se dejan oír truenos por doquier.",천둥번개 같은 순발력을 가지고 있다. 제브라이카가 전속력으로 달리면 천둥소리가 울려 퍼진다.,いなずまのような　しゅんぱつりょく。 ゼブライカが　ぜんそくりょくで はしると　らいめいが　ひびきわたる。
