en,fr,it,de,es,ko,kana
"When it hears the crash of thunder, Elekid’s mood improves. It can be useful to record that sound and play it when Elekid’s feeling down.","Il adore le bruit de la foudre. Si vous l’enregistrez, vous pouvez le lui diffuser à loisir pour le mettre de bonne humeur.","Il rombo dei tuoni lo mette di buon umore, perciò è utile averne una registrazione a portata di mano per quando è triste.","Elekid freut sich, wenn es Donner hört. Es lohnt sich, das Geräusch aufzunehmen und es ihm vorzuspielen, wenn es mal schlecht drauf ist.",El ruido de los truenos le mejora el ánimo. Conviene tener a mano una grabación para cuando esté en horas bajas.,번개 소리를 들으면 기분이 좋아진다. 우울해질 때를 대비해서 녹음해 두면 편리하다.,かみなりの　おちる　おとを　きくと 　ごきげん。　おちこんだときの　ために 　ろくおん　しておくと　べんりだよ。
"When flames drip from its nose, that means it has a cold. Have it lie down for a nice rest in some magma.","Lorsque de petites flammes s’échappent de son nez, c’est qu’il est enrhumé. Le meilleur remède est encore de lui donner un bain de lave.","Quando dalle narici escono piccole fiamme tremule, significa che è raffreddato. In questi casi bisogna farlo riposare nel magma.","Wenn es kleine Flammen aus seiner Nase ausstößt, ist es erkältet. Dann sollte man ihm eine Ruhepause in Magma gönnen.",Cuando se le escapan pequeñas llamaradas por el hocico significa que está resfriado y el mejor remedio es un buen baño de magma.,코에서 불꽃이 줄줄 흐른다면 감기에 걸린 것이다. 마그마에서 쉬게 해 주자.,はなから　ちょろちょろと　ほのおが 　もれているときは　かぜを　ひいている。 　マグマのなかで　やすませて　あげてね。
"It produces over five gallons of milk a day. The higher the quality of the pastures it lives in, the richer and tastier its milk becomes.",Les 20 litres de lait qu’il produit chaque jour gagneront en saveur et en caractère s’il vit dans un pâturage de bonne qualité.,"Produce 20 litri di latte al giorno. Più alta è la qualità del pascolo, più gustoso sarà il latte.","Es gibt täglich 20 l Milch. Je besser die Qualität des Grases ist, desto schmackhafter ist sie.","Produce 20 litros de leche al día, que es más sabrosa cuanto mejor sea el pasto.",하루에 20리터의 젖을 짠다. 목초의 질이 좋은 산지일수록 밀크는 진해서 맛있다.,ひに　２０リットルの　ちちを　だす。 　ぼくそうの　しつが　よい　とちほど 　だす　ミルクは　コクがあり　うまい。
Their eggs are such a delicacy that some say eating one will bring you happiness. These eggs fetch the highest prices on the market.,"Ses œufs sont si bons qu’il suffirait d’en manger un pour trouver le bonheur. Au marché, c’est le produit qui se vend le plus cher.",Le sue uova sono talmente deliziose che si dice rendano felice chiunque le mangi. Per questo hanno prezzi altissimi sul mercato.,"Sein Ei ist eine Kostbarkeit, denn es heißt, wer davon esse, werde glücklich. Auf dem Markt erzielt es deshalb Spitzenpreise.",Se dice que los huevos de Blissey están tan ricos que dan la felicidad a quien los prueba. Por eso alcanzan precios exorbitantes.,알을 먹으면 행복해진다고 전해질 정도로 맛이 일품이다. 시장에서 제일 가격이 비싸다.,タマゴは　たべると　しあわせになると 　いわれるほど　ぜっぴん。　しじょうで 　１ばん　たかい　ねだんが　つく。
Raikou embodies the speed of lightning. The roars of this Pokémon send shock waves shuddering through the air and shake the ground as if lightning bolts had come crashing down.,Raikou incarne la vitesse de l’éclair. Les rugissements de ce Pokémon libèrent des ondes de choc provenant du ciel et frappant le sol avec la puissance de la foudre.,Raikou rappresenta la velocità del fulmine. Il suo ruggito crea terrificanti onde d’urto nell’aria e scuote il suolo come se fosse percosso dalla furia di un fulmine durante il temporale.,"Raikou ist so schnell wie der Blitz. Das Gebrüll dieses Pokémon sendet Schockwellen aus, die wie Donnerschläge durch die Luft beben und den Boden erschüttern.",Raikou tiene la velocidad del rayo. Los rugidos de este Pokémon emiten ondas de choque que se esparcen vibrando por el aire y sacuden el suelo como si fueran auténticas descargas de rayo.,번개의 스피드가 깃들어 있는 포켓몬이다. 그 울음소리는 번개가 내리쳤을 때처럼 공기를 떨리게 하며 대지를 흔든다.,かみなりの　スピードを　やどした　ポケモン。 その　とおぼえは　かみなりが　おちた　ときの ように　くうきを　ふるわせ　だいちを　ゆるがす。
Entei embodies the passion of magma. This Pokémon is thought to have been born in the eruption of a volcano. It sends up massive bursts of fire that utterly consume all that they touch.,Entei incarne la colère du magma. On pense que ce Pokémon est né suite à l’éruption d’un volcan. Il peut envoyer d’énormes jets de flammes qui calcinent tout ce qu’ils touchent.,Entei rappresenta l’ardore del magma. Si narra che questo Pokémon sia nato dall’eruzione di un vulcano. Emette lingue di fuoco così violente da incenerire tutto ciò che lambiscono.,"Entei verfügt über die Leidenschaft von Magma. Dieses Pokémon wurde bei einem Vulkanausbruch geboren und bringt Feuersbrünste hervor, die alles auslöschen, was mit ihnen in Kontakt kommt.",Entei contiene el fulgor del magma en su interior. Se cree que este Pokémon nació de la erupción de un volcán. Escupe numerosas ráfagas de fuego que devoran y reducen a cenizas todo lo que tocan.,마그마의 정열이 깃들어 있는 포켓몬이다. 화산 분화 속에서 태어났다고 여겨지며 모든 것을 태워버리는 불꽃을 뿜어 올린다.,マグマの　じょうねつを　やどした　ポケモン。 かざんの　ふんかから　うまれたと　かんがえられ すべてを　やきつくす　ほのおを　ふきあげる。
Suicune embodies the compassion of a pure spring of water. It runs across the land with gracefulness. This Pokémon has the power to purify dirty water.,Suicune incarne la tranquillité d’une source d’eau pure. Il parcourt les plaines avec grâce. Ce Pokémon a le pouvoir de purifier l’eau.,Suicune rappresenta la purezza delle sorgenti d’acqua dolce. Corre con grazia immerso nella natura. Questo Pokémon ha la facoltà di depurare le acque di scarico.,"Suicune wohnt die Reinheit einer Quelle inne. Es läuft graziös herum und hat die Macht, schmutziges Wasser zu reinigen.",Suicune emana la pureza de los manantiales. Suele corretear por el campo con gran elegancia. Este Pokémon tiene el poder de purificar el agua contaminada.,솟아나는 물의 부드러움이 깃들어 있는 포켓몬이다. 흐르는 듯한 몸놀림으로 대지를 달려 탁해진 물을 맑게 하는 힘을 지녔다.,わきみずの　やさしさを　やどした　ポケモン。 すべる　ような　みのこなしで　だいちを　はしり にごった　みずを　きよめる　ちからを　もつ。
"Born underground, it eats its way through dirt to the surface, where its parents are. It doesn’t deal well with the bright light it finds there.","Il naît sous terre et doit se frayer un chemin à coups de mâchoire pour rejoindre ses parents à la surface. Il déteste la lumière, qui l’éblouit.","Nasce sottoterra e risale in superficie verso i genitori mangiando la terra lungo il cammino. Detesta la luce, che trova troppo abbagliante.","Es wird unterirdisch geboren und frisst sich durchs Erdreich an die Oberfläche zu seinen Eltern. Es verabscheut grelles, blendendes Licht.","Nace bajo el suelo y, para reunirse con sus progenitores en la superficie, asciende comiendo tierra. Evita la luz directa porque lo deslumbra.",지하에서 태어나 흙을 먹으면서 어버이가 있는 지상을 향해 올라간다. 눈이 부셔서 빛은 좋아하지 않는다.,ちかで　うまれ　つちを　くいながら 　おやの　いる　ちじょうを　めざす。 　まぶしいので　ひかりは　にがてだよ。
"This troublesome Pokémon can’t wait to evolve, so it relieves its stress by wildly propelling itself around using compressed gas.","Impatient d’évoluer, il évacue son stress en libérant des gaz sous haute pression qui le font bondir dans tous les sens. Une vraie plaie!","In attesa dell’evoluzione, sfoga la sua impazienza svolazzando ovunque spinto dal gas compresso che espelle, dando fastidio a tutti.","Es kann seine Entwicklung nicht erwarten und stört andere, wenn es zum Stressabbau mithilfe von komprimiertem Gas durch die Luft zischt.",Este Pokémon está impaciente por evolucionar y libera tensiones expulsando gas comprimido con el que se propulsa. Un verdadero incordio.,진화를 기다리지 못하고 압축가스로 날아다니며 날뛰어 스트레스를 해소하는 성가신 포켓몬.,しんかを　まてず　あっしゅくガスで 　とびまわり　あばれて　ストレスを 　かいしょうする　めいわくな　ポケモン。
"It wanders through the mountains seeking opponents to fight. If it finds an opponent that’s not worthy, Tyranitar ignores it and wanders on.","Il parcourt les montagnes à la recherche d’un adversaire. Si ce dernier n’est pas à la hauteur, il préfère l’ignorer et s’en aller.","Vaga tra i monti alla ricerca di avversari con cui lottare. Se però non li ritiene alla sua altezza, li ignora e se ne va.","Es durchstreift die Berge auf der Suche nach Gegnern. Begegnet es einem, der ihm nicht ebenbürtig ist, ignoriert es ihn und zieht weiter.","Recorre las montañas en busca de rivales para combatir. Si juzga que no están a su altura, los ignora y pasa de largo.",싸울 상대를 찾아 산을 떠돈다. 만나도 격이 떨어지는 상대라고 무시하고 떠나간다.,たたかう　あいてを　もとめて　やまを 　さまよう。　であっても　かくしたが 　あいてだと　むしして　さっていく。
"Lugia’s wings pack devastating power—a light fluttering of its wings can blow apart regular houses. As a result, this Pokémon chooses to live out of sight deep under the sea.","Les ailes de Lugia renferment une puissance dévastatrice. Un simple battement de ses ailes peut détruire de petites maisons. Du coup, ce Pokémon a choisi de vivre loin de tout, dans les profondeurs océaniques.","Le ali di Lugia hanno un’enorme potenza distruttiva: un leggero battito d’ali è in grado di abbattere una normale abitazione. Perciò il Pokémon ha scelto di vivere lontano dall’uomo, nelle profondità abissali.","Lugias Flügel haben eine zerstörerische Kraft. Bereits ein leichtes Flattern kann Häuser hinfortwehen. Daher hat sich dieses Pokémon dafür entschieden, tief unten im Meer zu leben, wo es niemand sieht.","La fuerza que tiene Lugia en las alas es devastadora; con nada que las bata es capaz de derribar edificios enteros. Por eso mismo, prefiere vivir donde no haya nadie, en lo más profundo del mar.",가벼운 날갯짓만으로도 민가를 날려버릴 만한 파괴력을 지니고 있어서 해저에서 사람들 몰래 살게 됐다.,つばさを　かるく　はばたかせた　だけで　みんかを ふきとばす　はかいりょくを　もっている　ために かいていで　ひとしれず　くらす　ように　なった。
Ho-Oh’s feathers glow in seven colors depending on the angle at which they are struck by light. These feathers are said to bring happiness to the bearers. This Pokémon is said to live at the foot of a rainbow.,Les plumes de Ho-Oh brillent de sept couleurs selon l’orientation de son corps par rapport à la lumière. On raconte que ces plumes portent bonheur. On dit aussi que ce Pokémon vit au pied d’un arc-en-ciel.,Il piumaggio di Ho-Oh brilla in sette colori a seconda dell’angolazione dei raggi luminosi. Si dice che le sue piume portino felicità a chi le possiede. Si narra che viva ai piedi di un arcobaleno.,"Ho-Ohs Federn leuchten in sieben Farben, je nachdem aus welchem Winkel das Licht auf sie fällt. Die Federn sollen ihrem Besitzer Glück bringen. Dieses Pokémon lebt am Fuße eines Regenbogens.","El plumaje de Ho-Oh contiene siete colores que pueden apreciarse según el ángulo desde el que les dé la luz. Dicen que sus plumas dan felicidad a quienes las llevan y, también, que este Pokémon vive a los pies del arco iris.",빛이 닿는 각도에 따라 일곱 빛깔로 반짝이는 깃털은 행복을 가져다준다고 한다. 무지개 끝에 산다고 전해진다.,ひかりの　あたる　かくどに　よって　なないろに かがやく　ハネは　しあわせを　もたらすと　いう。 にじの　ふもとに　すむと　いわれている。
"This Pokémon came from the future by crossing over time. It is thought that so long as Celebi appears, a bright and shining future awaits us.","Ce Pokémon est venu du futur en voyageant dans le temps. On raconte que quand Celebi apparaît, cela signifie que le futur sera bon et agréable.","Celebi è giunto a noi dal futuro, viaggiando attraverso il tempo. Si dice che ogni sua apparizione preannunci un futuro roseo e splendente.","Dieses Pokémon kommt aus der Zukunft und ist durch die Zeit gereist. Solange Celebi auftaucht, ist der Menschheit angeblich eine rosige Zukunft beschieden.","Este Pokémon vino del futuro haciendo un viaje en el tiempo. Hay quien piensa que, mientras Celebi siga apareciendo, hay un futuro brillante y esperanzador.",시간을 넘어 미래에서 찾아온 포켓몬이다. 세레비가 모습을 나타내는 한 밝은 미래가 기다린다고 여겨지고 있다.,ときを　こえ　みらいから　やってきた　ポケモン。 セレビィが　すがたを　あらわす　かぎり　あかるい みらいが　まっていると　かんがえられている。
"Treecko is cool, calm, and collected—it never panics under any situation. If a bigger foe were to glare at this Pokémon, it would glare right back without conceding an inch of ground.","Arcko est cool, calme et serein. Il ne panique jamais, quelle que soit la situation. Quand un ennemi plus gros que lui lui lance un regard de défi, ce Pokémon reste stoïque et ne cède pas un centimètre de terrain.","Treecko ha classe, è calmo e posato: non si lascia mai prendere dal panico. Quando affronta un nemico più grande di lui, lo fissa dritto negli occhi senza la minima esitazione.","Geckarbor ist ruhig und beherrscht, es gerät niemals in Panik. Wenn es ein stärkerer Feind zornig anstarrt, erwidert es den bösen Blick, weicht aber keinen Millimeter zurück.","Treecko es tranquilo y tiene gran capacidad de autocontrol; no pierde la calma en ninguna situación. Si algún rival se le queda mirando fijamente, le devolverá la mirada sin ceder ni lo más mínimo de su territorio.",침착 냉정 어떤 일에도 동요하지 않는다. 체격이 큰 포켓몬이 노려봐도 한 발짝도 물러서지 않고 같이 노려본다.,ちんちゃく　れいせい　なにごとにも　どうじない。 からだの　おおきな　ポケモンに　にらまれても いっぽも　ひかずに　にらみかえすぞ。
"This Pokémon adeptly flies from branch to branch in trees. In a forest, no Pokémon can ever hope to catch a fleeing Grovyle however fast they may be.","Ce Pokémon vole de branche en branche avec brio. En forêt, aucun Pokémon, même le plus rapide, ne peut espérer attraper un Massko qui s’enfuit.",Grovyle vola di ramo in ramo e di albero in albero. Non c’è nessun Pokémon nella foresta in grado di catturarlo in volo: la sua velocità è impressionante!,"Dieses Pokémon fliegt geschickt von Ast zu Ast. Keinem Pokémon wird es jemals gelingen, ein Reptain zu erwischen. Da kann es noch so schnell sein.","Este Pokémon revolotea de rama en rama con maestría. Cuando Grovyle va volando por el bosque, no hay quien lo alcance por muy rápido que sea.",가지에서 가지로 가볍게 뛰어다닌다. 아무리 빠른 포켓몬도 숲 속에서 나무돌이를 잡기란 불가능하다.,えだから　えだへ　みがるに　とびまわる。 どんなに　すばやい　ポケモンも　もりの　なかで ジュプトルを　つかまえる　ことは　ふかのうだ。
Sceptile has seeds growing on its back. They are said to be bursting with nutrients that revitalize trees. This Pokémon raises the trees in a forest with loving care.,Jungko a des graines qui lui poussent sur le dos. On dit qu’elles regorgent de nutriments qui revitalisent les arbres. Ce Pokémon s’occupe des forêts avec amour.,Sulla schiena di Sceptile crescono alcuni semi che si dice siano ricchi di nutrienti per gli alberi. Questo Pokémon coltiva amorevolmente le sue piante nella foresta.,"Auf Gewaldros Rücken wachsen Samen. Darin sind Nährstoffe, die Bäume beleben können. Dieses Pokémon achtet mit viel Fürsorge darauf, dass die Bäume seines Waldes prächtig gedeihen.","A Sceptile le crecen en la espalda unas semillas llenas de nutrientes que sirven para revitalizar los árboles. De hecho, se dedica a cuidarlos con mimo para que crezcan bien.",등의 씨앗에는 나무를 건강하게 만드는 영양이 많이 채워져 있다고 전해진다. 숲의 나무를 소중히 키우고 있는 포켓몬이다.,せなかの　タネには　じゅもくを　げんきにする えいようが　たくさん　つまっていると　いわれる。 もりの　きを　だいじに　そだてている　ポケモン。
Torchic has a place inside its body where it keeps its flame. Give it a hug—it will be glowing with warmth. This Pokémon is covered all over by a fluffy coat of down.,"Poussifeu dispose d’un endroit dans son corps pour stocker sa flamme. Si on lui fait un gros câlin, sa flamme s’illumine chaleureusement. Ce Pokémon est couvert d’un duvet très doux.",Nel corpo di Torchic è custodita la sua fiamma. Abbracciandolo si illumina emanando un incredibile calore. Questo Pokémon è ricoperto da un piumaggio soffice e caldo.,"In Flemmlis Körper brennt eine Flamme. Wenn man es umarmt, beginnt es zu glühen. Dieses Pokémon trägt ein flauschiges Fell aus Daunen.","Torchic tiene un lugar en el interior de su organismo en el que guarda la llama que posee. Si le das un abrazo, arderá encantado. Este Pokémon está recubierto totalmente de sedoso plumón.",체내에 불꽃을 태우는 곳이 있어서 껴안으면 따끈따끈 정말 따뜻하다. 전신이 푹신푹신한 깃털로 덮여 있다.,たいないに　ほのおを　もやす　ばしょが　あるので だきしめると　ぽかぽか　とっても　あたたかい。 ぜんしん　ふかふかの　うもうに　おおわれている。
Combusken battles with the intensely hot flames it spews from its beak and with outstandingly destructive kicks. This Pokémon’s cry is very loud and distracting.,Galifeu combat grâce aux flammes ardentes qu’il crache de son bec et à ses coups de pied destructeurs. Le cri de ce Pokémon est très puissant et très gênant pour l’adversaire.,Combusken combatte sputando fiamme roventi dal becco e sferrando calci dall’enorme potenza distruttiva. Il verso di questo Pokémon è lacerante e distrae gli avversari.,Jungglut stößt im Kampf glühend heiße Flammen aus seinem Schnabel aus und setzt extrem vernichtende Tritte ein. Das Geschrei dieses Pokémon ist sehr laut und verwirrend.,Combusken lucha haciendo uso de las abrasadoras llamas que expulsa por el pico y de unas patadas fulminantes. Este Pokémon emite un sonido muy fuerte y molesto.,부리에서 토해 내는 작열하는 불꽃과 뛰어난 파괴력의 킥으로 싸운다. 울음소리가 커서 무척 시끄럽다.,クチバシから　はきだす　しゃくねつの　ほのおと はかいりょく　ばつぐんの　キックで　たたかう。 なきごえが　おおきいので　とても　やかましい。
Blaziken has incredibly strong legs—it can easily clear a 30-story building in one leap. This Pokémon’s blazing punches leave its foes scorched and blackened.,Braségali a des jambes incroyablement puissantes. Il peut sauter par-dessus un immeuble de trente étages. Les coups de poing enflammés de ce Pokémon peuvent carboniser ses ennemis.,Blaziken è dotato di zampe molto potenti in grado di radere al suolo un edificio di 30 piani in un colpo solo. I suoi pugni fulminei lasciano il nemico ustionato e talvolta carbonizzato.,"Lohgock besitzt unglaublich starke Beine, mit denen es ein 30 Stockwerke hohes Gebäude mit einem Sprung überwinden kann. Die flammenden Schläge dieses Pokémon lassen verkohlte Gegner zurück.","Blaziken tiene unas piernas tan fuertes que puede saltar por encima de un edificio de 30 pisos con facilidad. Además, da unos puñetazos fulminantes que dejan al oponente chamuscado y lleno de tizne.",강인한 하반신을 지녀 30층짜리 빌딩도 가볍게 뛰어넘을 수 있다. 불꽃의 펀치로 상대를 새까맣게 태운다.,きょうじんな　あしこしを　もち　３０かい　だての ビルも　らくらく　とびこす　ことが　できる。 ほのおの　パンチで　あいてを　くろこげに　する。
"In water, Mudkip breathes using the gills on its cheeks. If it is faced with a tight situation in battle, this Pokémon will unleash its amazing power—it can crush rocks bigger than itself.","Sous l’eau, Gobou peut respirer grâce aux branchies sur ses joues. S’il se retrouve en difficulté pendant un combat, ce Pokémon déchaîne ses pouvoirs incroyables. Il peut détruire des rochers plus gros que lui.","In acqua Mudkip respira usando le branchie sulle mascelle. In caso di situazioni critiche nella lotta scatena la sua forza strabiliante, riuscendo a frantumare rocce più grandi di lui.","Im Wasser atmet Hydropi durch die Kiemen an seinen Wangen. Wenn es im Kampf in eine brenzlige Situation gerät, setzt es seine verblüffende Kraft ein, mit der es Felsbrocken zerquetschen kann, die größer sind als es selbst.","En el agua, Mudkip usa las branquias que tiene en los mofletes para respirar. Cuando tiene que enfrentarse a una situación delicada en combate, desata una fuerza asombrosa con la que puede destruir rocas incluso mayores que él.",물속에서는 뺨의 아가미로 호흡한다. 위급해지면 몸보다 큰 바위를 산산이 부숴버리는 파워를 발휘한다.,すいちゅうでは　ほっぺの　エラで　こきゅうする。 ピンチに　なると　からだより　おおきな　いわを こなごなに　くだく　パワーを　はっきする。
"Marshtomp is much faster at traveling through mud than it is at swimming. This Pokémon’s hindquarters exhibit obvious development, giving it the ability to walk on just its hind legs.","Flobio est bien plus rapide dans la boue que dans l’eau. L’arrière-train de ce Pokémon est particulièrement développé, ce qui lui donne la capacité de marcher sur ses pattes arrière.","Marshtomp è molto più a suo agio nel fango che non in acqua e sa muoversi con estrema rapidità. La parte inferiore del suo corpo mostra un chiaro sviluppo, consentendogli di camminare solo sugli arti inferiori.","Moorabbel kommt im Schlamm besser voran als im Wasser. Das Hinterteil dieses Pokémon ist gut entwickelt, sodass es auf seinen Hinterbeinen laufen kann.","Marshtomp se desplaza más rápido por el lodo que por el agua. Los cuartos traseros de este Pokémon muestran un desarrollo más que evidente, lo que le permite andar solo sobre las patas traseras.",물속을 헤엄치는 것보다 진흙 속에서 이동하는 편이 훨씬 빠르게 이동할 수 있다.  하반신이 발달하여 두 다리로 걷는다.,すいちゅうを　およぐより　どろの　なかを すすむ　ほうが　だんぜん　はやく　いどうできる。 あしこしが　はったつして　２ほんあしで　あるく。
"Swampert predicts storms by sensing subtle differences in the sounds of waves and tidal winds with its fins. If a storm is approaching, it piles up boulders to protect itself.","Laggron peut prédire l’arrivée des tempêtes en utilisant ses nageoires pour sentir les variations dans les vagues et les marées. Si une tempête s’approche, il empile des rochers pour protéger son habitat.","Swampert prevede le tempeste poiché grazie alle pinne percepisce le sottili differenze nel suono delle onde e dei venti dovuti alle maree. In caso di burrasca imminente, crea delle pile di massi per proteggere la tana.","Sumpex kann Stürme voraussagen, indem es feine Veränderungen der Geräusche von Wellen und Wind mit seinen Flossen wahrnimmt. Wenn eine Sturmfront aufzieht, häuft es Felsbrocken an, um sich zu schützen.","Swampert puede predecir tormentas al percibir con las aletas los sutiles cambios que producen las olas y las corrientes. Si está a punto de estallar una tormenta, empezará a apilar piedras para resguardarse.",대짱이는 파도 소리나 바닷바람의 아주 작은 차이를 지느러미로 감지하여 태풍을 예감한다. 태풍이 불면 바위를 쌓아서 둥지를 지킨다.,ラグラージは　なみおとや　しおかぜの　わずかな ちがいを　ヒレで　かんじ　あらしを　よかんする。 あらしになると　いわを　つみあげ　すを　まもる。
